"Story","Title","Result","Date","Stability","Duration (s)"
"Delete a comment","Delete a comment with valid id","SUCCESS","2023-01-20T15:10:41.361+07:00[Asia/Bangkok]","0.0","9.73"
"Delete a comment","Delete a comment with invalid id","FAILURE","2023-01-20T15:10:51.147+07:00[Asia/Bangkok]","0.0","1.25"
"Delete a comment","Delete a comment without authentication","SUCCESS","2023-01-20T15:10:52.449+07:00[Asia/Bangkok]","0.0","0.44"
"Delete a comment","Delete a comment with unregistered id","FAILURE","2023-01-20T15:10:52.933+07:00[Asia/Bangkok]","0.0","0.92"
"Delete a comment","Delete a comment with invalid path","SUCCESS","2023-01-20T15:10:53.891+07:00[Asia/Bangkok]","0.0","1.45"
