"Story","Title","Result","Date","Stability","Duration (s)"
"Create new comment","Post create new comment with valid json","SUCCESS","2023-01-20T15:11:06.78+07:00[Asia/Bangkok]","0.0","1.36"
"Create new comment","Post create new comment with invalid path","SUCCESS","2023-01-20T15:11:08.262+07:00[Asia/Bangkok]","0.0","1.1"
"Create new comment","Post create new comment without authentication","SUCCESS","2023-01-20T15:11:09.375+07:00[Asia/Bangkok]","0.0","0.8"
"Create new comment","Post create new comment with empty json key","SUCCESS","2023-01-20T15:11:10.193+07:00[Asia/Bangkok]","0.0","0.85"
"Create new comment","Post create new comment with invalid json","SUCCESS","2023-01-20T15:11:11.064+07:00[Asia/Bangkok]","0.0","0.36"
